{
  "$schema": "https://json-schema.org/draft/2020-12/schema",
  "title": "Crabpot fixture manifest",
  "type": "object",
  "required": ["version", "submoduleRoot", "fixtures"],
  "additionalProperties": false,
  "properties": {
    "version": { "type": "integer", "minimum": 1 },
    "submoduleRoot": { "type": "string", "pattern": "^[^/].*" },
    "openclaw": {
      "type": "object",
      "additionalProperties": false,
      "properties": {
        "minimumNode": { "type": "string" },
        "defaultCheckoutPath": { "type": "string" }
      }
    },
    "resourceWorkloads": {
      "type": "array",
      "items": {
        "type": "object",
        "additionalProperties": false,
        "required": ["id", "pluginId", "adapter", "requiredOperations", "why"],
        "properties": {
          "id": { "type": "string", "pattern": "^[a-z0-9][a-z0-9-]*$" },
          "pluginId": { "type": "string", "pattern": "^[a-z0-9][a-z0-9-]*$" },
          "adapter": { "type": "string", "pattern": "^[a-z0-9][a-z0-9-]*$" },
          "requiredOperations": {
            "type": "object", "minProperties": 1,
            "propertyNames": {
              "pattern": "^[a-z0-9][a-z0-9-]*$",
              "not": { "enum": ["startup", "idle", "neutral-rpc", "post-neutral", "post-work"] }
            },
            "additionalProperties": { "type": "integer", "minimum": 1, "maximum": 1000 }
          },
          "pairedWorkload": {
            "type": "object", "additionalProperties": false,
            "required": ["dependencies", "targetActivation"],
            "properties": {
              "dependencies": {
                "type": "array", "uniqueItems": true,
                "items": { "type": "string", "pattern": "^[a-z0-9][a-z0-9-]*$" }
              },
              "targetActivation": { "enum": ["startup", "workload", "scoped"] }
            }
          },
          "why": { "type": "string", "minLength": 1 }
        }
      }
    },
    "fixtures": {
      "type": "array",
      "minItems": 1,
      "items": {
        "type": "object",
        "required": ["id", "name", "path", "priority", "seams", "why"],
        "additionalProperties": false,
        "oneOf": [{ "required": ["repo"] }, { "required": ["package"] }],
        "properties": {
          "id": { "type": "string", "pattern": "^[a-z0-9][a-z0-9-]*$" },
          "name": { "type": "string", "minLength": 1 },
          "repo": { "type": "string", "pattern": "^https://github.com/.+\\.git$" },
          "package": {
            "type": "object",
            "required": ["name"],
            "additionalProperties": false,
            "properties": {
              "name": { "type": "string", "minLength": 1 },
              "version": { "type": "string", "minLength": 1 },
              "tag": { "type": "string", "minLength": 1 },
              "artifactSource": { "enum": ["npm", "source-pack"] }
            }
          },
          "source": {
            "type": "object",
            "required": ["repo", "path", "ref"],
            "additionalProperties": false,
            "properties": {
              "repo": { "type": "string", "pattern": "^https://github.com/.+\\.git$" },
              "path": { "type": "string", "pattern": "^[^/].*" },
              "ref": { "type": "string", "minLength": 1 }
            }
          },
          "path": { "type": "string", "pattern": "^plugins/[a-z0-9][a-z0-9-]*$" },
          "subdir": { "type": "string", "minLength": 1 },
          "priority": { "enum": ["high", "medium", "low"] },
          "seams": {
            "type": "array",
            "minItems": 1,
            "items": { "type": "string", "pattern": "^[a-z0-9][a-z0-9-]*$" },
            "uniqueItems": true
          },
          "expect": {
            "type": "object",
            "additionalProperties": false,
            "properties": {
              "hooks": {
                "type": "array",
                "items": { "type": "string", "pattern": "^[a-z0-9_:-]+$" },
                "uniqueItems": true
              },
              "registrations": {
                "type": "array",
                "items": { "type": "string", "pattern": "^[A-Za-z][A-Za-z0-9]*$" },
                "uniqueItems": true
              },
              "manifestContracts": {
                "type": "array",
                "items": { "type": "string", "pattern": "^[A-Za-z][A-Za-z0-9]*$" },
                "uniqueItems": true
              }
            }
          },
          "execution": {
            "type": "object",
            "additionalProperties": false,
            "properties": {
              "gatewayMethodPrerequisites": {
                "type": "object",
                "propertyNames": { "type": "string", "pattern": "\\S" },
                "additionalProperties": { "type": "string", "pattern": "\\S" }
              },
              "gatewayMethodExpectations": {
                "type": "object",
                "propertyNames": { "type": "string", "pattern": "\\S", "maxLength": 256 },
                "additionalProperties": {
                  "type": "object",
                  "required": ["ok"],
                  "additionalProperties": false,
                  "properties": {
                    "ok": { "type": "boolean" },
                    "payload": {},
                    "error": {
                      "type": "object",
                      "required": ["code", "message"],
                      "additionalProperties": false,
                      "properties": {
                        "code": { "type": "string", "minLength": 1 },
                        "message": { "type": "string", "minLength": 1 },
                        "details": {},
                        "retryable": { "type": "boolean" },
                        "retryAfterMs": { "type": "integer", "minimum": 0 }
                      }
                    }
                  }
                }
              },
              "blockedFailures": {
                "type": "array",
                "minItems": 1,
                "items": {
                  "type": "object",
                  "required": ["id", "seam", "errorIncludes", "reason"],
                  "additionalProperties": false,
                  "properties": {
                    "id": { "type": "string", "minLength": 1 },
                    "seam": { "type": "string", "minLength": 1 },
                    "errorIncludes": { "type": "string", "minLength": 1 },
                    "reason": { "type": "string", "minLength": 1 },
                    "exitCode": { "type": "integer", "minimum": 1 },
                    "outputPattern": { "type": "string", "minLength": 1 }
                  }
                }
              }
            }
          },
          "why": { "type": "string", "minLength": 1 }
        }
      }
    }
  }
}
