{
  "$schema": "./crabpot.schema.json",
  "version": 1,
  "submoduleRoot": "plugins",
  "openclaw": {
    "minimumNode": "24",
    "defaultCheckoutPath": "../openclaw"
  },
  "resourceWorkloads": [
    {
      "id": "file-transfer-fetch-v1",
      "pluginId": "file-transfer",
      "adapter": "file-transfer",
      "requiredOperations": { "first-use": 1, "warm-work": 20 },
      "why": "Real paired-node file-fetch policy, preflight binding, integrity validation, saved media and plugin audit records over a fixed synthetic 64 KiB payload."
    },
    {
      "id": "memory-wiki-local-cycle-v1",
      "pluginId": "memory-wiki",
      "adapter": "memory-wiki",
      "requiredOperations": {
        "first-use": 1,
        "warm-work": 20
      },
      "why": "Real local wiki mutation, default compilation/publication and verified page retrieval/search over a fixed synthetic corpus; no model or shared-memory backend."
    },
    {
      "id": "beam-receiver-cycle-v1",
      "pluginId": "beam",
      "adapter": "beam",
      "requiredOperations": { "first-use": 1, "warm-work": 20 },
      "why": "Authenticated HTTP receiver, real plugin state and catalog read/archive through Gateway RPC."
    },
    {
      "id": "session-share-receiver-v1",
      "pluginId": "session-share",
      "adapter": "session-share",
      "requiredOperations": { "first-use": 1, "warm-work": 20 },
      "why": "Real session catalog receiver and paired node invocation with deterministic remote session responses."
    },
    {
      "id": "typesafe-systemone-decisions-v1",
      "pluginId": "typesafe",
      "adapter": "typesafe",
      "requiredOperations": { "first-use": 1, "warm-work": 20 },
      "why": "Source-checkout TypeSafe decision-provider lifecycle through the core decision tool and a strict local System One peer; no hosted credentials or model inference."
    },
    {
      "id": "workboard-card-crud-v1",
      "pluginId": "workboard",
      "adapter": "workboard",
      "requiredOperations": { "first-use": 1, "warm-work": 20 },
      "why": "Real bundled plugin activation and SQLite-backed card CRUD through authenticated Gateway RPC."
    }
  ],
  "fixtures": [
    {
      "id": "agentchat",
      "name": "AgentChat OpenClaw Channel",
      "repo": "https://github.com/agentchatme/agentchat-openclaw.git",
      "path": "plugins/agentchat",
      "priority": "high",
      "seams": ["channel", "prompt-mutation", "config-schema", "websocket", "backpressure"],
      "expect": {
        "registrations": ["defineChannelPluginEntry"]
      },
      "why": "Production-shaped channel plugin with WebSocket auth, reconnect, prompt hints, and typed runtime contracts."
    },
    {
      "id": "wecom",
      "name": "WeCom Enhanced Channel",
      "repo": "https://github.com/sunnoy/openclaw-plugin-wecom.git",
      "path": "plugins/wecom",
      "priority": "high",
      "seams": ["channel", "streaming", "dynamic-agent-routing", "message-policy", "media"],
      "expect": {
        "hooks": [
          "before_prompt_build",
          "subagent_delivery_target",
          "subagent_spawned",
          "subagent_ended",
          "before_tool_call"
        ],
        "registrations": ["registerChannel", "registerTool", "registerHttpRoute"]
      },
      "why": "Large community channel fixture covering WS streaming, group/DM policy, command allowlists, media, and dynamic agents."
    },
    {
      "id": "qqbot",
      "name": "QQbot",
      "repo": "https://github.com/tencent-connect/openclaw-qqbot.git",
      "path": "plugins/qqbot",
      "priority": "high",
      "seams": ["channel", "media", "proactive-messaging", "cron", "sdk-preload"],
      "expect": {
        "registrations": ["registerChannel", "registerTool"]
      },
      "why": "QQ Bot channel fixture covering rich media, proactive messaging, cron/reminder tools, and preload-based SDK/runtime compatibility."
    },
    {
      "id": "a2a-gateway",
      "name": "A2A Gateway",
      "repo": "https://github.com/win4r/openclaw-a2a-gateway.git",
      "path": "plugins/a2a-gateway",
      "priority": "high",
      "seams": ["gateway-service", "http-routes", "agent-routing", "async-job", "auth"],
      "expect": {
        "registrations": ["registerService", "registerTool"]
      },
      "why": "Agent-to-agent server fixture with agent-card discovery, JSON-RPC/REST/gRPC transports, metrics, peer auth, and async task modes."
    },
    {
      "id": "hasdata",
      "name": "HasData",
      "repo": "https://github.com/HasData/hasdata-openclaw-plugin.git",
      "path": "plugins/hasdata",
      "priority": "high",
      "seams": ["tool", "tool-schema", "external-api", "cli", "config-schema"],
      "expect": {
        "manifestContracts": ["tools"],
        "registrations": ["registerTool"]
      },
      "why": "Single native tool backed by a large OpenAPI-derived action catalog and strict per-action schemas."
    },
    {
      "id": "mcp-adapter",
      "name": "MCP Adapter",
      "repo": "https://github.com/androidStern-personal/openclaw-mcp-adapter.git",
      "path": "plugins/mcp-adapter",
      "priority": "high",
      "seams": ["dynamic-tool", "json-schema", "stdio", "http", "reconnect"],
      "expect": {
        "registrations": ["registerService", "registerTool"]
      },
      "why": "Dynamic tool discovery from MCP servers with stdio/http transports and schema passthrough."
    },
    {
      "id": "aiwerk-mcp-bridge",
      "name": "AIWerk MCP Bridge",
      "package": {
        "name": "@aiwerk/openclaw-mcp-bridge",
        "tag": "latest"
      },
      "path": "plugins/aiwerk-mcp-bridge",
      "priority": "medium",
      "seams": ["dynamic-tool", "mcp", "tool-refresh", "unregister-tool", "oauth-transport", "skill-bundle"],
      "expect": {
        "registrations": ["registerTool"]
      },
      "why": "NPM-pinned MCP bridge fixture covering router/direct dynamic tool modes, MCP list refresh with unregisterTool fallback, OAuth/header/env-substituted remote transports, and bundled MCP server recipes plus skills."
    },
    {
      "id": "llm-trace-phoenix",
      "name": "Phoenix LLM Trace",
      "repo": "https://github.com/pingshian0131/openclaw-plugin-llm-trace-phoenix.git",
      "path": "plugins/llm-trace-phoenix",
      "priority": "high",
      "seams": ["llm-observer", "conversation-access", "telemetry", "external-api"],
      "expect": {
        "hooks": ["llm_input", "llm_output"]
      },
      "why": "Small sharp fixture for llm_input/llm_output access and raw prompt/output privacy boundaries."
    },
    {
      "id": "opik-openclaw",
      "name": "Opik OpenClaw",
      "repo": "https://github.com/comet-ml/opik-openclaw.git",
      "path": "plugins/opik-openclaw",
      "priority": "high",
      "seams": ["llm-observer", "tool-runtime", "subagent-routing", "diagnostics", "cli"],
      "expect": {
        "hooks": [
          "llm_input",
          "llm_output",
          "before_tool_call",
          "after_tool_call",
          "subagent_spawning",
          "subagent_delivery_target",
          "subagent_spawned",
          "subagent_ended",
          "tool_result_persist",
          "agent_end"
        ],
        "registrations": ["registerService", "registerCli"]
      },
      "why": "Opik trace exporter covering LLM spans, tool spans, subagent spans, stale trace cleanup, CLI setup, and persisted tool-result sanitization."
    },
    {
      "id": "openclaw-telemetry",
      "name": "OpenClaw Telemetry",
      "repo": "https://github.com/knostic/openclaw-telemetry.git",
      "path": "plugins/openclaw-telemetry",
      "priority": "high",
      "seams": ["diagnostics", "llm-observer", "tool-runtime", "message-lifecycle", "gateway-service"],
      "expect": {
        "hooks": [
          "before_tool_call",
          "after_tool_call",
          "message_received",
          "message_sent",
          "before_agent_start",
          "agent_end"
        ],
        "registrations": ["registerService"]
      },
      "why": "Telemetry fixture covering high-volume lifecycle hooks, tool-call capture, message events, JSONL/syslog sinks, redaction, rate limiting, and integrity hash chains."
    },
    {
      "id": "lossless-claw",
      "name": "Lossless Claw (LCM)",
      "repo": "https://github.com/Martian-Engineering/lossless-claw.git",
      "path": "plugins/lossless-claw",
      "priority": "high",
      "seams": ["context-engine", "prompt-mutation", "session-lifecycle", "gateway-lifecycle", "dynamic-tool"],
      "expect": {
        "hooks": ["before_reset", "before_prompt_build", "session_end", "gateway_start", "gateway_stop"],
        "registrations": ["registerContextEngine", "registerTool", "registerCommand"]
      },
      "why": "Lossless context-management fixture covering context engine registration, DAG compaction tools, prompt assembly hooks, session cleanup, and gateway maintenance lifecycle."
    },
    {
      "id": "connectclaw",
      "name": "ConnectClaw",
      "repo": "https://github.com/osipov-anton/connectclaw.git",
      "path": "plugins/connectclaw",
      "subdir": "packages/plugin",
      "priority": "high",
      "seams": ["dynamic-tool", "external-api", "gateway-service", "process-spawn", "hono-relay"],
      "expect": {
        "hooks": ["before_agent_start"],
        "registrations": ["registerTool", "registerCommand", "registerService"]
      },
      "why": "Contacts/messaging plugin with dynamic tool factories, command handlers, a polling service that wakes agents via the OpenClaw CLI, and a Hono relay package in the same repo."
    },
    {
      "id": "hyperspell",
      "name": "Hyperspell OpenClaw",
      "repo": "https://github.com/hyperspell/hyperspell-openclaw.git",
      "path": "plugins/hyperspell",
      "priority": "high",
      "seams": ["dynamic-tool", "external-memory", "cli"],
      "expect": {
        "registrations": ["registerCli", "registerCommand", "registerTool"]
      },